{
  "schema_version": "1.0.0",
  "feed_type": "alerts",
  "t_s": 11400,
  "sim_time": "2027-03-01T03:10:00Z",
  "alerts": [
    {
      "alert_id": "EV-000016",
      "t_s": 10980,
      "at": "2027-03-01T03:03:00Z",
      "kind": "STATUS_CHANGE",
      "severity": "INFO",
      "robot_id": "P2-03",
      "subsystem": null,
      "channel": null,
      "title": "P2-03 ACTIVE -> MAINTENANCE_REQUIRED (keeps working until a bay frees)",
      "detail": "",
      "ref_id": "WO-20270301-0002"
    },
    {
      "alert_id": "EV-000015",
      "t_s": 10980,
      "at": "2027-03-01T03:03:00Z",
      "kind": "WORK_ORDER",
      "severity": "WARNING",
      "robot_id": "P2-03",
      "subsystem": null,
      "channel": null,
      "title": "WO-20270301-0002 created for P2-03 (WARNING)",
      "detail": "",
      "ref_id": "PR-000002"
    },
    {
      "alert_id": "EV-000014",
      "t_s": 10920,
      "at": "2027-03-01T03:02:00Z",
      "kind": "PREDICTION",
      "severity": "WARNING",
      "robot_id": "P2-03",
      "subsystem": "POWER",
      "channel": "battery_voltage_v",
      "title": "P2-03 battery degradation predicted, about 82 min to failure",
      "detail": "Confidence 0.71; predicted failure at t = 15840 s",
      "ref_id": "AN-000002"
    },
    {
      "alert_id": "EV-000013",
      "t_s": 10860,
      "at": "2027-03-01T03:01:00Z",
      "kind": "ANOMALY",
      "severity": "WARNING",
      "robot_id": "P2-03",
      "subsystem": "POWER",
      "channel": "battery_voltage_v",
      "title": "P2-03 battery voltage sags more than 0.5 V below the expected value under load",
      "detail": "P2-03 battery voltage sags more than 0.5 V below the expected value under load",
      "ref_id": "AN-000002"
    },
    {
      "alert_id": "EV-000012",
      "t_s": 10680,
      "at": "2027-03-01T02:58:00Z",
      "kind": "ANOMALY",
      "severity": "WARNING",
      "robot_id": "P2-02",
      "subsystem": "THERMAL",
      "channel": "wheel_fl_temp_c",
      "title": "P2-02 front-left drive temperature is more than 15 degC above its TRAVERSE_EMPTY baseline",
      "detail": "P2-02 front-left drive temperature is more than 15 degC above its TRAVERSE_EMPTY baseline",
      "ref_id": "AN-000001"
    },
    {
      "alert_id": "EV-000011",
      "t_s": 10560,
      "at": "2027-03-01T02:56:00Z",
      "kind": "STATUS_CHANGE",
      "severity": "INFO",
      "robot_id": "P2-02",
      "subsystem": null,
      "channel": null,
      "title": "P2-02 MAINTENANCE_REQUIRED -> EN_ROUTE_P5",
      "detail": "",
      "ref_id": "WO-20270301-0001"
    },
    {
      "alert_id": "EV-000007",
      "t_s": 10560,
      "at": "2027-03-01T02:56:00Z",
      "kind": "STATUS_CHANGE",
      "severity": "INFO",
      "robot_id": "P2-04",
      "subsystem": null,
      "channel": null,
      "title": "P2-04 STANDBY -> ACTIVE",
      "detail": "",
      "ref_id": null
    },
    {
      "alert_id": "EV-000006",
      "t_s": 10560,
      "at": "2027-03-01T02:56:00Z",
      "kind": "STANDBY_SWAP",
      "severity": "INFO",
      "robot_id": "P2-02",
      "subsystem": null,
      "channel": null,
      "title": "P2-04 selected to replace P2-02 on M-HAUL-B (highest SOC of eligible standbys)",
      "detail": "eligible = STANDBY + NORMAL health + SOC >= 60; pick highest SOC",
      "ref_id": "P2-04"
    },
    {
      "alert_id": "EV-000004",
      "t_s": 10560,
      "at": "2027-03-01T02:56:00Z",
      "kind": "STATUS_CHANGE",
      "severity": "INFO",
      "robot_id": "P2-02",
      "subsystem": null,
      "channel": null,
      "title": "P2-02 ACTIVE -> MAINTENANCE_REQUIRED",
      "detail": "",
      "ref_id": "WO-20270301-0001"
    },
    {
      "alert_id": "EV-000003",
      "t_s": 10560,
      "at": "2027-03-01T02:56:00Z",
      "kind": "WORK_ORDER",
      "severity": "CRITICAL",
      "robot_id": "P2-02",
      "subsystem": null,
      "channel": null,
      "title": "WO-20270301-0001 created for P2-02 (CRITICAL)",
      "detail": "",
      "ref_id": "PR-000001"
    },
    {
      "alert_id": "EV-000002",
      "t_s": 10500,
      "at": "2027-03-01T02:55:00Z",
      "kind": "PREDICTION",
      "severity": "CRITICAL",
      "robot_id": "P2-02",
      "subsystem": "MOBILITY",
      "channel": "wheel_fl_temp_c",
      "title": "P2-02 hub bearing wear predicted, about 56 min to failure",
      "detail": "Confidence 0.78; predicted failure at t = 13860 s",
      "ref_id": "PR-000001"
    }
  ]
}
