{
  "schema_version": "1.0.0",
  "feed_type": "alerts",
  "t_s": 9899,
  "sim_time": "2027-03-01T02:44:59Z",
  "alerts": [
    {
      "alert_id": "EV-000015",
      "t_s": 9899,
      "at": "2027-03-01T02:44:59Z",
      "kind": "PREDICTION",
      "severity": "WARNING",
      "robot_id": "P2-01",
      "subsystem": "MOBILITY",
      "channel": "wheel_rr_current_a",
      "title": "P2-01: wheel drag in regolith suspected (rear-right wheel drive), about 40 min to failure",
      "detail": "Confidence 1.00; predicted failure T+3:24",
      "ref_id": "PR-000010"
    },
    {
      "alert_id": "EV-000014",
      "t_s": 9659,
      "at": "2027-03-01T02:40:59Z",
      "kind": "PREDICTION",
      "severity": "WARNING",
      "robot_id": "P2-01",
      "subsystem": "MOBILITY",
      "channel": "wheel_rr_current_a",
      "title": "P2-01: wheel drag in regolith suspected (rear-right wheel drive), about 59 min to failure",
      "detail": "Confidence 1.00; predicted failure T+3:40",
      "ref_id": "PR-000009"
    },
    {
      "alert_id": "EV-000013",
      "t_s": 9599,
      "at": "2027-03-01T02:39:59Z",
      "kind": "PREDICTION",
      "severity": "WARNING",
      "robot_id": "P2-01",
      "subsystem": "MOBILITY",
      "channel": "wheel_rr_current_a",
      "title": "P2-01: wheel drag in regolith suspected (rear-right wheel drive), about 65 min to failure",
      "detail": "Confidence 1.00; predicted failure T+3:45",
      "ref_id": "PR-000008"
    },
    {
      "alert_id": "EV-000012",
      "t_s": 8939,
      "at": "2027-03-01T02:28:59Z",
      "kind": "PREDICTION",
      "severity": "WARNING",
      "robot_id": "P2-01",
      "subsystem": "MOBILITY",
      "channel": "wheel_rr_current_a",
      "title": "P2-01: wheel drag in regolith suspected (rear-right wheel drive), about 101 min to failure",
      "detail": "Confidence 1.00; predicted failure T+4:09",
      "ref_id": "PR-000007"
    },
    {
      "alert_id": "EV-000011",
      "t_s": 7559,
      "at": "2027-03-01T02:05:59Z",
      "kind": "PREDICTION",
      "severity": "WARNING",
      "robot_id": "P2-01",
      "subsystem": "MOBILITY",
      "channel": "wheel_rr_current_a",
      "title": "P2-01: wheel drag in regolith suspected (rear-right wheel drive), about 86 min to failure",
      "detail": "Confidence 1.00; predicted failure T+3:31",
      "ref_id": "PR-000006"
    },
    {
      "alert_id": "EV-000008",
      "t_s": 7259,
      "at": "2027-03-01T02:00:59Z",
      "kind": "ANOMALY",
      "severity": "WARNING",
      "robot_id": "P2-01",
      "subsystem": "MOBILITY",
      "channel": "wheel_rr_speed_rads",
      "title": "P2-01 rear-right wheel speed is 0.08 rad/s below its TRAVERSE_LOADED baseline",
      "detail": "MOBILITY / wheel_rr_drive; began T+2:00",
      "ref_id": "AN-000002"
    },
    {
      "alert_id": "EV-000007",
      "t_s": 7259,
      "at": "2027-03-01T02:00:59Z",
      "kind": "ANOMALY",
      "severity": "WARNING",
      "robot_id": "P2-01",
      "subsystem": "MOBILITY",
      "channel": "wheel_rr_current_a",
      "title": "P2-01 rear-right drive motor current is 1.03 A above its TRAVERSE_LOADED baseline",
      "detail": "MOBILITY / wheel_rr_drive; began T+2:00",
      "ref_id": "AN-000001"
    },
    {
      "alert_id": "EV-000006",
      "t_s": 6959,
      "at": "2027-03-01T01:55:59Z",
      "kind": "PREDICTION",
      "severity": "WARNING",
      "robot_id": "P2-01",
      "subsystem": "MOBILITY",
      "channel": "wheel_rr_current_a",
      "title": "P2-01: wheel drag in regolith suspected (rear-right wheel drive), about 72 min to failure",
      "detail": "Confidence 1.00; predicted failure T+3:08",
      "ref_id": "PR-000005"
    },
    {
      "alert_id": "EV-000005",
      "t_s": 6659,
      "at": "2027-03-01T01:50:59Z",
      "kind": "PREDICTION",
      "severity": "WARNING",
      "robot_id": "P2-01",
      "subsystem": "MOBILITY",
      "channel": "wheel_rr_current_a",
      "title": "P2-01: wheel drag in regolith suspected (rear-right wheel drive), about 99 min to failure",
      "detail": "Confidence 1.00; predicted failure T+3:29",
      "ref_id": "PR-000004"
    }
  ]
}
