{
  "schema_version": "1.0.0",
  "feed_type": "alerts",
  "t_s": 10679,
  "sim_time": "2027-03-01T02:57:59Z",
  "alerts": [
    {
      "alert_id": "EV-000014",
      "t_s": 10679,
      "at": "2027-03-01T02:57:59Z",
      "kind": "PREDICTION",
      "severity": "CRITICAL",
      "robot_id": "P2-02",
      "subsystem": "MOBILITY",
      "channel": "wheel_fl_temp_c",
      "title": "P2-02: wheel hub bearing wear suspected (front-left wheel drive), about 43 min to failure",
      "detail": "Confidence 1.00; predicted failure T+3:41",
      "ref_id": "PR-000012"
    },
    {
      "alert_id": "EV-000013",
      "t_s": 10619,
      "at": "2027-03-01T02:56:59Z",
      "kind": "ANOMALY",
      "severity": "WARNING",
      "robot_id": "P2-02",
      "subsystem": "THERMAL",
      "channel": "wheel_fl_temp_c",
      "title": "P2-02 front-left drive temperature is 15.01 degC above its TRAVERSE_EMPTY baseline",
      "detail": "THERMAL / wheel_fl_thermal; began T+2:56",
      "ref_id": "AN-000001"
    },
    {
      "alert_id": "EV-000012",
      "t_s": 10559,
      "at": "2027-03-01T02:55:59Z",
      "kind": "PREDICTION",
      "severity": "CRITICAL",
      "robot_id": "P2-02",
      "subsystem": "MOBILITY",
      "channel": "wheel_fl_temp_c",
      "title": "P2-02: wheel hub bearing wear suspected (front-left wheel drive), about 57 min to failure",
      "detail": "Confidence 1.00; predicted failure T+3:53",
      "ref_id": "PR-000011"
    },
    {
      "alert_id": "EV-000011",
      "t_s": 10439,
      "at": "2027-03-01T02:53:59Z",
      "kind": "PREDICTION",
      "severity": "CRITICAL",
      "robot_id": "P2-02",
      "subsystem": "MOBILITY",
      "channel": "wheel_fl_temp_c",
      "title": "P2-02: wheel hub bearing wear suspected (front-left wheel drive), about 71 min to failure",
      "detail": "Confidence 1.00; predicted failure T+4:04",
      "ref_id": "PR-000010"
    },
    {
      "alert_id": "EV-000010",
      "t_s": 10199,
      "at": "2027-03-01T02:49:59Z",
      "kind": "PREDICTION",
      "severity": "CRITICAL",
      "robot_id": "P2-02",
      "subsystem": "MOBILITY",
      "channel": "wheel_fl_temp_c",
      "title": "P2-02: wheel hub bearing wear suspected (front-left wheel drive), about 100 min to failure",
      "detail": "Confidence 1.00; predicted failure T+4:29",
      "ref_id": "PR-000009"
    },
    {
      "alert_id": "EV-000009",
      "t_s": 9479,
      "at": "2027-03-01T02:37:59Z",
      "kind": "PREDICTION",
      "severity": "CRITICAL",
      "robot_id": "P2-02",
      "subsystem": "MOBILITY",
      "channel": "wheel_fl_temp_c",
      "title": "P2-02: wheel hub bearing wear suspected (front-left wheel drive), about 139 min to failure",
      "detail": "Confidence 1.00; predicted failure T+4:56",
      "ref_id": "PR-000008"
    },
    {
      "alert_id": "EV-000008",
      "t_s": 9299,
      "at": "2027-03-01T02:34:59Z",
      "kind": "PREDICTION",
      "severity": "CRITICAL",
      "robot_id": "P2-02",
      "subsystem": "MOBILITY",
      "channel": "wheel_fl_temp_c",
      "title": "P2-02: wheel hub bearing wear suspected (front-left wheel drive), about 101 min to failure",
      "detail": "Confidence 1.00; predicted failure T+4:15",
      "ref_id": "PR-000007"
    },
    {
      "alert_id": "EV-000007",
      "t_s": 8879,
      "at": "2027-03-01T02:27:59Z",
      "kind": "PREDICTION",
      "severity": "CRITICAL",
      "robot_id": "P2-02",
      "subsystem": "MOBILITY",
      "channel": "wheel_fl_temp_c",
      "title": "P2-02: wheel hub bearing wear suspected (front-left wheel drive), about 81 min to failure",
      "detail": "Confidence 1.00; predicted failure T+3:49",
      "ref_id": "PR-000006"
    },
    {
      "alert_id": "EV-000006",
      "t_s": 8759,
      "at": "2027-03-01T02:25:59Z",
      "kind": "PREDICTION",
      "severity": "CRITICAL",
      "robot_id": "P2-02",
      "subsystem": "MOBILITY",
      "channel": "wheel_fl_temp_c",
      "title": "P2-02: wheel hub bearing wear suspected (front-left wheel drive), about 116 min to failure",
      "detail": "Confidence 1.00; predicted failure T+4:21",
      "ref_id": "PR-000005"
    }
  ]
}
