{
  "schema_version": "1.0.0",
  "feed_type": "alerts",
  "t_s": 7679,
  "sim_time": "2027-03-01T02:07:59Z",
  "alerts": [
    {
      "alert_id": "EV-000014",
      "t_s": 7439,
      "at": "2027-03-01T02:03:59Z",
      "kind": "PREDICTION",
      "severity": "WARNING",
      "robot_id": "P2-03",
      "subsystem": "THERMAL",
      "channel": "wheel_fr_temp_c",
      "title": "P2-03: thermal / cooling fault suspected (front-right drive heat-rejection path), about 59 min to failure",
      "detail": "Confidence 1.00; predicted failure T+3:03",
      "ref_id": "PR-000011"
    },
    {
      "alert_id": "EV-000013",
      "t_s": 7319,
      "at": "2027-03-01T02:01:59Z",
      "kind": "PREDICTION",
      "severity": "WARNING",
      "robot_id": "P2-03",
      "subsystem": "THERMAL",
      "channel": "wheel_fr_temp_c",
      "title": "P2-03: thermal / cooling fault suspected (front-right drive heat-rejection path), about 80 min to failure",
      "detail": "Confidence 1.00; predicted failure T+3:21",
      "ref_id": "PR-000010"
    },
    {
      "alert_id": "EV-000011",
      "t_s": 7199,
      "at": "2027-03-01T01:59:59Z",
      "kind": "PREDICTION",
      "severity": "WARNING",
      "robot_id": "P2-03",
      "subsystem": "THERMAL",
      "channel": "wheel_fr_temp_c",
      "title": "P2-03: thermal / cooling fault suspected (front-right drive heat-rejection path), about 113 min to failure",
      "detail": "Confidence 1.00; predicted failure T+3:53",
      "ref_id": "PR-000009"
    },
    {
      "alert_id": "EV-000010",
      "t_s": 7139,
      "at": "2027-03-01T01:58:59Z",
      "kind": "ANOMALY",
      "severity": "WARNING",
      "robot_id": "P2-03",
      "subsystem": "THERMAL",
      "channel": "wheel_fr_temp_c",
      "title": "P2-03 front-right drive temperature is 15.00 degC above its IDLE baseline",
      "detail": "THERMAL / wheel_fr_thermal; began T+1:58",
      "ref_id": "AN-000001"
    },
    {
      "alert_id": "EV-000009",
      "t_s": 6839,
      "at": "2027-03-01T01:53:59Z",
      "kind": "PREDICTION",
      "severity": "WARNING",
      "robot_id": "P2-03",
      "subsystem": "THERMAL",
      "channel": "wheel_fr_temp_c",
      "title": "P2-03: thermal / cooling fault suspected (front-right drive heat-rejection path), about 147 min to failure",
      "detail": "Confidence 1.00; predicted failure T+4:21",
      "ref_id": "PR-000008"
    },
    {
      "alert_id": "EV-000008",
      "t_s": 6239,
      "at": "2027-03-01T01:43:59Z",
      "kind": "PREDICTION",
      "severity": "WARNING",
      "robot_id": "P2-03",
      "subsystem": "THERMAL",
      "channel": "wheel_fr_temp_c",
      "title": "P2-03: thermal / cooling fault suspected (front-right drive heat-rejection path), about 208 min to failure",
      "detail": "Confidence 1.00; predicted failure T+5:12",
      "ref_id": "PR-000007"
    },
    {
      "alert_id": "EV-000007",
      "t_s": 6119,
      "at": "2027-03-01T01:41:59Z",
      "kind": "PREDICTION",
      "severity": "WARNING",
      "robot_id": "P2-03",
      "subsystem": "THERMAL",
      "channel": "wheel_fr_temp_c",
      "title": "P2-03: thermal / cooling fault suspected (front-right drive heat-rejection path), about 145 min to failure",
      "detail": "Confidence 1.00; predicted failure T+4:07",
      "ref_id": "PR-000006"
    },
    {
      "alert_id": "EV-000006",
      "t_s": 5759,
      "at": "2027-03-01T01:35:59Z",
      "kind": "PREDICTION",
      "severity": "WARNING",
      "robot_id": "P2-03",
      "subsystem": "THERMAL",
      "channel": "wheel_fr_temp_c",
      "title": "P2-03: thermal / cooling fault suspected (front-right drive heat-rejection path), about 99 min to failure",
      "detail": "Confidence 1.00; predicted failure T+3:14",
      "ref_id": "PR-000005"
    },
    {
      "alert_id": "EV-000005",
      "t_s": 5099,
      "at": "2027-03-01T01:24:59Z",
      "kind": "PREDICTION",
      "severity": "WARNING",
      "robot_id": "P2-03",
      "subsystem": "THERMAL",
      "channel": "wheel_fr_temp_c",
      "title": "P2-03: thermal / cooling fault suspected (front-right drive heat-rejection path), about 84 min to failure",
      "detail": "Confidence 1.00; predicted failure T+2:48",
      "ref_id": "PR-000004"
    },
    {
      "alert_id": "EV-000004",
      "t_s": 4859,
      "at": "2027-03-01T01:20:59Z",
      "kind": "PREDICTION",
      "severity": "WARNING",
      "robot_id": "P2-03",
      "subsystem": "THERMAL",
      "channel": "wheel_fr_temp_c",
      "title": "P2-03: thermal / cooling fault suspected (front-right drive heat-rejection path), about 111 min to failure",
      "detail": "Confidence 1.00; predicted failure T+3:12",
      "ref_id": "PR-000003"
    },
    {
      "alert_id": "EV-000003",
      "t_s": 4379,
      "at": "2027-03-01T01:12:59Z",
      "kind": "PREDICTION",
      "severity": "WARNING",
      "robot_id": "P2-03",
      "subsystem": "THERMAL",
      "channel": "wheel_fr_temp_c",
      "title": "P2-03: thermal / cooling fault suspected (front-right drive heat-rejection path), about 157 min to failure",
      "detail": "Confidence 1.00; predicted failure T+3:49",
      "ref_id": "PR-000002"
    }
  ]
}
